{
  "$schema": "https://json-schema.org/draft/2020-12/schema",
  "$id": "https://obsidian-panshi.local/skills/obsidian-task-decomposer/schemas/input.schema.json",
  "title": "obsidian-task-decomposer input contract",
  "description": "Strict input for the Obsidian Plan task-decomposition skill. Version 1.0.0. Breaking changes require a major version bump (see skill.yaml compatibility policy).",
  "type": "object",
  "additionalProperties": false,
  "required": [
    "task_id", "project_id", "request", "skill_version", "controller_version",
    "timestamp", "risk_level", "human_approval_state", "requested_output_format"
  ],
  "properties": {
    "task_id": {
      "type": "string",
      "minLength": 1,
      "maxLength": 128,
      "pattern": "^[A-Za-z0-9][A-Za-z0-9._:-]*$",
      "description": "Unique id of this decomposition request, assigned by the controller."
    },
    "project_id": {
      "type": "string",
      "minLength": 1,
      "maxLength": 128,
      "pattern": "^[A-Za-z0-9][A-Za-z0-9._:-]*$"
    },
    "request": {
      "type": "string",
      "minLength": 10,
      "maxLength": 20000,
      "description": "The task contract or research objective to decompose, in natural language. Must state an objective; pure questions without a deliverable are boundary cases."
    },
    "context": {
      "type": "string",
      "maxLength": 50000,
      "description": "Background material the decomposer may rely on (prior findings, mission lock contract text, constraints narrative)."
    },
    "constraints": {
      "type": "object",
      "additionalProperties": false,
      "description": "Hard limits the plan must respect.",
      "properties": {
        "max_total_hours": {"type": "number", "exclusiveMinimum": 0, "maximum": 100000},
        "max_cost": {"type": "number", "exclusiveMinimum": 0, "maximum": 100000000},
        "currency": {"type": "string", "maxLength": 8},
        "deadline": {"type": "string", "pattern": "^\\d{4}-\\d{2}-\\d{2}"},
        "max_nodes": {"type": "integer", "minimum": 1, "maximum": 500},
        "forbidden_skills": {"type": "array", "items": {"type": "string", "maxLength": 128}, "maxItems": 100},
        "required_skills": {"type": "array", "items": {"type": "string", "maxLength": 128}, "maxItems": 100}
      }
    },
    "evidence_refs": {
      "type": "array",
      "maxItems": 500,
      "items": {
        "type": "object",
        "additionalProperties": false,
        "required": ["ref_id", "kind", "locator"],
        "properties": {
          "ref_id": {"type": "string", "minLength": 1, "maxLength": 128},
          "kind": {"type": "string", "enum": ["paper", "dataset", "report", "prior_output", "standard", "other"]},
          "locator": {"type": "string", "minLength": 1, "maxLength": 2000, "description": "DOI, URL, path, or store key. Must be resolvable by the controller; this skill never fabricates locators."},
          "note": {"type": "string", "maxLength": 2000}
        }
      }
    },
    "data_refs": {
      "type": "array",
      "maxItems": 500,
      "items": {
        "type": "object",
        "additionalProperties": false,
        "required": ["ref_id", "locator"],
        "properties": {
          "ref_id": {"type": "string", "minLength": 1, "maxLength": 128},
          "locator": {"type": "string", "minLength": 1, "maxLength": 2000},
          "sensitivity": {"type": "string", "enum": ["public", "internal", "sensitive", "restricted"]},
          "note": {"type": "string", "maxLength": 2000}
        }
      }
    },
    "upstream_outputs": {
      "type": "array",
      "maxItems": 100,
      "description": "Artifacts produced by previously completed skills that this decomposition must build on.",
      "items": {
        "type": "object",
        "additionalProperties": false,
        "required": ["skill", "artifact_ref"],
        "properties": {
          "skill": {"type": "string", "minLength": 1, "maxLength": 128},
          "artifact_ref": {"type": "string", "minLength": 1, "maxLength": 2000},
          "summary": {"type": "string", "maxLength": 4000}
        }
      }
    },
    "requested_output_format": {
      "type": "string",
      "enum": ["json", "markdown+json"],
      "description": "Machine consumption target. 'json' = output.schema.json document only; 'markdown+json' = human summary plus the JSON document."
    },
    "risk_level": {
      "type": "string",
      "enum": ["low", "medium", "high"],
      "description": "Controller-assessed risk of the work being decomposed. high forces human-approval gates on irreversible nodes."
    },
    "human_approval_state": {
      "type": "object",
      "additionalProperties": false,
      "required": ["required", "granted"],
      "properties": {
        "required": {"type": "boolean"},
        "granted": {"type": "boolean"},
        "granted_by": {"type": "string", "maxLength": 128},
        "granted_at": {"type": "string", "maxLength": 40},
        "scope": {"type": "string", "maxLength": 2000, "description": "What exactly was approved."}
      },
      "description": "If required=true and granted=false the skill must return HUMAN_APPROVAL_REQUIRED for gated nodes, not plan around the gate."
    },
    "skill_version": {
      "type": "string",
      "pattern": "^\\d+\\.\\d+\\.\\d+$",
      "description": "Version of this skill the controller believes it is calling. Mismatch with the installed version is reported in provenance."
    },
    "controller_version": {
      "type": "string",
      "minLength": 1,
      "maxLength": 64
    },
    "timestamp": {
      "type": "string",
      "pattern": "^\\d{4}-\\d{2}-\\d{2}T\\d{2}:\\d{2}:\\d{2}",
      "description": "ISO-8601 request time, controller clock."
    },
    "replan_of": {
      "type": "object",
      "additionalProperties": false,
      "description": "Present when this request is a local replan of an earlier decomposition.",
      "required": ["prior_plan_artifact_ref", "trigger"],
      "properties": {
        "prior_plan_artifact_ref": {"type": "string", "minLength": 1, "maxLength": 2000},
        "trigger": {
          "type": "object",
          "additionalProperties": false,
          "required": ["reason"],
          "properties": {
            "reason": {"type": "string", "minLength": 1, "maxLength": 4000},
            "failed_node_ids": {"type": "array", "items": {"type": "string", "maxLength": 128}, "maxItems": 100},
            "changed_node_ids": {"type": "array", "items": {"type": "string", "maxLength": 128}, "maxItems": 100},
            "new_evidence_refs": {"type": "array", "items": {"type": "string", "maxLength": 2000}, "maxItems": 100}
          }
        }
      }
    }
  }
}
